no,displayUserNick,rateContent,rateDate,package,quality,price,service,logistics,other,sentiment
483,稳***妖,茶叶盒上介绍的字都被刮了，味不正宗。,2016-7-3 6:52,1,1,0,0,0,0,1
484,l***0,宝贝很好，很新鲜。味道也可以。赞一个！,2016-7-2 17:52,0,1,0,0,0,0,0
485,t***4,茶是新茶 还没有开始喝 等过一个月喝了再评价 嘿嘿,2016-7-1 8:05,0,1,0,0,0,0,0
486,古***今,茶叶不错，汤色清亮，口感香醇。,2016-6-29 15:19,0,1,0,0,0,0,0
487,m***真,茶叶还可以 好,2016-6-29 11:04,0,1,0,0,0,0,0
488,w***5,茶收到了，口味很好，喝完再来。,2016-6-28 19:43,0,1,0,0,0,0,0
489,z***l,这个五分主要是评论给店里客服的态度。东西送人的，目前还不知道茶叶好不好,2016-6-25 23:42,0,0,0,1,0,0,0
490,沦***6,一如既往的好，相信这个牌子,2016-6-24 12:13,0,0,0,0,0,1,0
491,城***士,不错，还没喝，发货快。,2016-6-23 19:44,0,0,0,1,0,0,0
492,y***6,发货快 物流快,2016-6-23 8:24,0,0,0,1,1,0,0
493,双***5,品尝后追评。,2016-6-22 21:37,0,0,0,0,0,0,0
494,荷***0,实惠，碎叶少,2016-6-20 20:25,0,0,0,0,0,0,2
495,冀***x,这次的茶实在差强人意，碎，茶梗多，味道也一般，唉,2016-6-20 12:22,0,1,0,0,0,0,1
496,5***4,一般吧，没有预期的好,2016-6-19 23:39,0,0,0,0,0,0,1
497,w***b,送人的 包装不错,2016-6-19 22:31,1,0,0,0,0,0,0
498,l***t,,2016-6-19 19:36,0,0,0,0,0,0,0
499,高***努,第一次买卢正浩的茶叶，感觉很不错，茶叶鲜嫩，由于是新茶微苦是正常的，果断好评！,2016-6-18 17:50,0,1,0,0,0,1,0
