no,displayUserNick,rateContent,rateDate,package,quality,price,service,logistics,other,sentiment
0,m***m,好,2015-12-12 13:37,0,0,0,0,0,0,0
1,t***0,茶叶没有想象中的香，勉强给好评吧。,2015-12-10 13:23,0,1,0,0,0,0,1
2,w***9,ko,2015-12-6 15:33,0,0,0,0,0,0,0
3,t***8,很好的龙井茶，口感很不错，品牌值得信赖,2015-11-29 23:21,0,1,0,0,0,1,0
4,s***人,评价晚了，茶叶很好爸妈很喜欢,2015-11-22 3:20,0,1,0,0,0,0,0
5,笔***菊,老顾客了，这次买了两盒，还没拆开喝。,2015-11-21 21:59,0,0,0,0,0,1,2
6,c***h,囤了好多茶，估计可以喝到来年开新茶，希望这茶喝起来很ok.,2015-11-18 12:01,0,0,0,0,0,0,2
7,x***8,囤货中，没空喝。先好评！,2015-11-15 19:37,0,0,0,0,0,0,0
8,笔***菊,雨前老茶树龙井味道很正宗，不错，实惠,2015-10-25 16:37,0,1,1,0,0,0,0
9,济***子,茶叶不错，喝着放心,2015-10-9 22:05,0,1,0,0,0,0,0
10,项***8,老客户了！,2015-9-24 13:00,0,0,0,0,0,1,0
11,怎***5,不错，绝对了,2015-9-22 14:57,0,1,0,0,0,0,0
12,淘***网,非常好，一次性买了2罐，一如既往地好喝，喜欢的味道，以后还会再来买的！,2015-9-21 9:17,0,1,0,0,0,0,0
13,卖***家,不好，不好喝，不值,2015-9-20 12:57,0,1,0,0,0,0,1
14,t***0,挺好的还送了赠品&apos;以后买茶叶就选你家了,2015-9-18 19:06,0,0,0,0,0,1,0
15,丁***8,茶叶不好 泡一次就没味了,2015-9-16 14:39,0,1,0,0,0,1,1
16,1***1,这个价格还不错，茶叶比较碎，但是听嫩的，这个价格还是不错的,2015-9-9 9:28,0,1,1,0,0,0,1
17,p***8,课题,2015-9-6 10:50,0,0,0,0,0,0,2
18,d***3,评价晚了~茶叶真心特别的好喝。不腻，香甜。感觉比他们家那种大包的好喝太多了，虽然比那个贵，但是感觉真心值这个价钱了！！！！满分！！,2015-9-5 20:34,0,1,1,0,0,0,0
19,s***3,发货速度超快,2015-8-31 13:07,0,0,0,1,0,0,0
20,y***0,茶品上乘，色香味俱全。 包装好，送达快。,2016-5-6 10:33,1,1,0,0,1,0,0
21,王***1,还没喝，口感应该差不了。,2016-5-5 22:26,0,0,0,0,0,0,0
22,t***2,很好的雨前。一直都是在这买的。,2016-4-26 1:35,0,1,0,0,0,0,0
23,n***n,非常好喝，出乎意料的好品质，以后买西湖龙井就认准这家了！,2016-4-25 14:08,0,1,0,0,0,0,0
24,s***n,感觉这一罐比前两天买的50克明前茶豆香味要浓一些。,2016-4-25 9:57,0,1,0,0,0,0,0
25,婆***调,收到了，过段时间再评价,2016-4-23 12:41,0,0,0,0,0,0,2
26,c***8,是正宗的西湖龙井，香气还可以，就是回甘差些。 很好,2016-4-22 15:37,0,1,0,0,0,0,1
27,t***1,老店的就是好，香，回味甜，茶根都不苦涩。刚在聚划算又下了一单E包装的，看看再追评,2016-4-20 7:36,0,1,0,0,0,0,0
28,f***4,这次茶叶真的棒，几乎没有碎的，新茶鲜嫩甘洌，就是不大经冲。,2016-4-18 20:36,0,1,0,0,0,1,1
29,我***5,产品还可以吧！,2016-4-18 18:30,0,1,0,0,0,0,0
30,p***1,茶叶好喝，一直喝的是卢正浩的龙井茶。,2016-4-17 22:34,0,1,0,0,0,0,0
31,w***1,口感还行，有个别黄叶子。,2016-4-14 21:19,0,1,0,0,0,0,1
32,尹***物,味道很好，下次还会来的！,2016-4-13 7:23,0,1,0,0,0,0,0
33,z***2,发货很慢,2016-4-12 15:26,0,0,0,1,0,0,1
34,z***0,订了两款新茶来品尝，数量不多。但店家为了让买家早一点尝鲜，很贴心的分成了两次发货，时间只相隔一天。已经品尝了味道很好，值得购买。 发货快，物流迅速，好。,2016-4-11 16:13,0,1,0,1,1,0,0
35,果***0,雨前茶相比于明前茶耐泡一些，味道也厚实一些，价格便宜，值得购买，唯一不足的是碎渣挺多，有些影响整个茶的形象,2016-4-10 15:02,0,1,1,0,0,0,1
36,孤***桥,,2016-3-16 20:21,0,0,0,0,0,0,0
37,l***1,还是一如既往的好啊！还会再买哦！,2016-3-9 12:52,0,0,0,0,0,0,0
38,卿***4,可以吧,2016-1-25 10:39,0,0,0,0,0,0,0
39,我***8,很好 香味比较浓郁 挺耐泡的 很满意,2015-12-23 20:09,0,1,0,0,0,1,0
40,m***0,这款味道比较淡哦,2016-7-14 9:49,0,1,0,0,0,0,1
41,恋***檬,送人的，朋友说还不错，好评,2016-7-13 21:56,0,0,0,0,0,0,0
42,0***0,茶叶味道不错~好评,2016-7-12 22:39,0,1,0,0,0,0,0
43,何***安,别的不多说，就一个字，好。。。,2016-7-10 17:09,0,0,0,0,0,0,0
44,木***波,相信老品牌品质,2016-7-7 8:11,0,0,0,0,0,1,0
45,t***2,还不错，老爸很喜欢喝。快递中间出了差错，不过卖家给补发了ems特快，很不错感谢。,2016-7-1 1:13,0,1,0,0,1,0,0
46,b***i,不错包装很好，还送了礼品袋和杯子，很好，喝着也很好,2016-6-24 21:04,1,1,0,0,0,0,0
47,k***9,味道挺好的,2016-6-24 11:35,0,1,0,0,0,0,0
48,邹***雪,父亲节给爸爸买的，应该还好吧。,2016-6-23 13:57,0,0,0,0,0,0,0
49,t***2,包装不错，茶叶也不错，值得大家购买。,2016-6-21 12:34,1,1,0,0,0,0,0
50,c***h,包装不错，快递很快。茶还没喝&hellip;,2016-6-21 0:01,1,0,0,0,1,0,0
51,随***歌,滋味浓郁,2016-6-20 16:01,0,1,0,0,0,0,0
52,k***9,豆香浓浓的 是我喜欢的味道 茶汤清澈 耐泡,2016-6-15 14:52,0,1,0,0,0,0,0
53,孔***9,老顾客了,2016-6-13 13:43,0,0,0,0,0,0,0
54,一***6,相信品牌的力量，干茶香，茶汤香味纯正，有回甘。,2016-6-8 16:35,0,1,0,0,0,1,0
55,哲***9,看着不错，还没吃,2016-6-8 8:37,0,0,0,0,0,1,0
56,我***菲,买来送人的，包装精细，至于茶的味道嘛，就不做评价了。,2016-6-7 15:56,1,0,0,0,0,0,0
57,h***g,,2016-5-25 15:43,0,0,0,0,0,0,0
58,苑***民,还没喝 喝过以后在来评价,2016-5-12 21:57,0,0,0,0,0,0,2
59,h***g,,2016-5-10 21:50,0,0,0,0,0,0,0
