no,displayUserNick,rateContent,rateDate,package,quality,price,service,logistics,other,sentiment
1361,l***0,一如既往的好,2016-6-8 16:11,0,0,0,0,0,0,0
1362,j***g,还不错，好评,2016-6-8 15:48,0,0,0,0,0,0,0
1363,p***6,今年第二次在他家买了，这次参加聚划算，价格实惠。遗憾的是，紫砂杯送的太少，手慢，没抢到。 服务和物流尚可。,2016-6-8 15:42,0,0,1,1,0,0,0
1364,飘***b,茶已收到，很满意，老客老店铺，必须全五分。,2016-6-8 15:35,0,0,0,0,0,0,0
1365,买***外,速度不错，就是送的紫砂杯变成了黄砂杯。。。。习惯性好评,2016-6-8 15:26,0,0,0,1,1,0,0
1366,j***0,已经是第二次购买了！好,2016-6-8 15:22,0,0,0,0,0,0,0
1367,n***5,本人平时喝岩茶，夏天感觉应该喝点绿茶对身体比较有好处，特看见这次66促销买了点卢正浩西湖龙井。感觉味道很好，清清爽爽，性价比高。,2016-6-8 15:21,0,1,1,0,0,0,0
1368,t***1,看着还可以，还没喝呢？以后在追加评价吧，,2016-6-8 15:21,0,0,0,0,0,0,0
1369,小***2,"是老宾客了，综合感觉不错，汤色清亮，牛皮纸包装防潮,质量一直很好,店家的服务也很到位,每逢优惠活动都会支持!  03.23 服务好，发货快",2016-6-8 15:10,1,1,0,1,0,0,0
1370,a***l,不错，包装挺好，等喝了以后再来追评。,2016-6-8 15:03,1,0,0,0,0,0,0
1371,s***判,不错，蛮划算的，性价比很高。,2016-6-8 15:03,0,0,1,0,0,0,0
1372,潍***俊,包装严谨，物流给力，很不错的做工，泡了一杯，里面掺杂一些叶梗，总的来说不错的口粮茶,2016-6-8 14:43,1,1,0,0,1,0,0
1373,靓***爱,好像我是前一百名的，还送了一只紫砂杯，茶叶看上去还不错。第一次在网上买茶叶。,2016-6-8 14:41,0,0,0,1,0,0,0
1374,丁***爷,聚划算时候买的，茶叶很好，物美价廉。,2016-6-8 14:38,0,1,1,0,0,0,0
1375,y***3,茶香浓，叶嫩，不错！,2016-6-8 14:34,0,1,0,0,0,0,0
1376,跑***东,一如既往地好，这次快递很给力，第二天就到了。,2016-6-8 14:15,0,0,0,0,1,0,0
1377,领***爷,满意，茶汤颜色好，质优价廉。,2016-6-8 13:41,0,1,1,0,0,0,0
1378,x***0,满意的网购，可靠的质量。感谢客服小梅的热情、耐心的解答所需要了解的问题，消除顾虑，心情舒畅，给予好评！,2016-6-8 13:39,0,1,1,0,0,0,0
1379,s***8,,2016-6-8 13:34,0,0,0,0,0,0,
1380,t***2,喝了，还行,2016-6-8 19:27,0,0,0,0,0,0,0
1381,x***1,茶叶比较香，还没有喝，暂时先给好评。,2016-6-8 19:23,0,1,0,0,0,0,0
1382,t***1,应该是正品,2016-6-8 19:10,0,0,0,0,0,1,0
1383,z***p,味道不错，可惜没有赠品,2016-6-8 19:05,0,1,0,1,0,0,0
1384,李***6,,2016-6-8 18:42,0,0,0,0,0,0,
1385,引***局,快递公司非常好，两天到货，茶叶还没喝，以后再补评吧,2016-6-8 18:31,0,1,0,0,0,0,0
1386,q***d,经常看到你们上聚划算，虽然没喝，应该是好茶。还抢到一紫砂壶，这次购得愉快。,2016-6-8 18:11,0,0,0,0,0,0,0
1387,s***r,还没开始喝，习惯性好评。,2016-6-8 18:10,0,0,0,0,0,0,0
1388,逛***毛,宝贝已收到，泡了一杯还不错！！！！,2016-6-8 18:06,0,1,0,0,0,0,0
1389,夏***树,聚划算买的，包装挺好，茶色翠绿，满意喜欢，好评！,2016-6-8 18:00,1,1,0,0,0,0,0
1390,叶***3,物流给力，茶很好的，5分。,2016-6-8 17:56,0,1,0,0,1,0,0
1391,叶***3,品质很好的，物流也很快，给5分！还会继续合作。,2016-6-8 17:55,0,1,0,0,1,0,0
1392,风***淀,质优价廉，特别适合下午喝一杯。,2016-6-8 17:41,0,1,1,0,0,0,0
1393,浪***3,品尝过几家龙井 感觉卢正浩最好 不掺假说新茶就是新茶 而且在质量上也略胜别的家 今后喝龙井就你家了所以看做活动就趸了点货 现在有好几斤茶叶 够喝一阵了 喝完再来,2016-6-8 17:37,0,1,0,0,0,0,0
1394,r***9,包装很精致，价格很合理。。。很赞，下次还会光顾。,2016-6-8 17:36,1,0,0,0,0,0,0
1395,d***8,聚划算买的，应该比平时便宜点。,2016-6-8 17:29,0,0,1,0,0,0,0
1396,酌***澜,闻起来茶香清新，泡出来茶汤清亮，口感不错，有回甘，没有碎叶，很好！ 非常满意,2016-6-8 16:51,0,1,0,0,0,0,0
1397,周***5,很好，老顾客了。,2016-6-8 16:28,0,0,0,0,0,0,0
1398,c***d,好快的，物流速度赞一个。,2016-6-8 16:28,0,0,0,0,1,0,0
1399,y***8,茶叶品相不错，物超所值，16年新茶三级挺值的。,2016-6-8 16:25,0,1,1,0,0,0,0
1400,l***n,非常满意。,2016-6-8 22:24,0,0,0,0,0,0,0
1401,牛***9,好评。好茶，好店。 快 捷。,2016-6-8 22:22,0,0,0,0,0,0,0
1402,爱***8,味道不错，新茶，喝完会再来买的。,2016-6-8 22:18,0,1,0,0,0,0,0
1403,s***9,茶叶比较一般，没有嫩芽，好在价格也不贵,2016-6-8 21:55,0,1,1,0,0,0,1
1404,y***7,龙井茶我喝了有好几家，这家的龙井味儿确实很正宗，这个价格能够喝到这种茶很不错了。点赞。还会来。,2016-6-8 21:53,0,1,1,0,0,0,0
1405,t***3,货已收到！先不说别的！端午节送礼没有给个小小的手提袋有点遗憾了！,2016-6-8 21:50,0,0,0,0,0,0,0
1406,江***7,喜欢你家的茶，口感不错，再次购买 物流太快了，惊讶,2016-6-8 21:41,0,1,0,0,0,0,0
1407,c***3,几乎集齐了卢正浩的所有杯子。,2016-6-8 21:32,0,0,0,0,0,0,0
1408,j***b,"超值,神速",2016-6-8 21:28,0,0,0,1,1,0,0
1409,璐***瓜,龙井茶不错，值这个价,2016-6-8 21:06,0,0,1,0,0,0,0
1410,t***2,一如即往的好，还会再来,2016-6-8 20:49,0,0,0,0,0,0,0
1411,d***6,茶叶还不错，,2016-6-8 20:39,0,0,0,0,0,0,0
1412,j***g,干活回来泡一杯龙井，解乏又解渴，包装也不错，香味很足。,2016-6-8 20:33,1,1,0,0,0,0,0
1413,x***i,好茶叶，清香味醇，叶片整齐，招待茶友很拿得出手，很争面子。 包装紧扎，发货迅速，快递得力。,2016-6-8 20:31,0,0,0,0,0,0,0
1414,j***0,多次购买了，茶香质量好！每次活动我都会光临。 满意！,2016-6-8 20:26,0,1,0,0,0,0,0
1415,w***2,好茶，口感不错。,2016-6-8 20:18,0,1,0,0,0,0,0
1416,昊***云,还行吧，绿色的茶叶，挺耐泡的，习惯五星好评,2016-6-8 20:16,0,1,0,0,0,0,0
1417,微***8,茶很不错，买了几次了,2016-6-8 20:11,0,0,0,0,0,0,0
1418,v***c,茶叶不错，就是泡出来香味不够,2016-6-8 20:03,0,1,0,0,0,0,1
1419,l***8,自己喝的，觉得口感不错。谢谢！ 好。,2016-6-8 19:46,0,1,0,0,0,0,0
1420,生***磨,茶叶可以  但是没有送东西，上次买的送的杯子 菊花 还有品尝包 这次怎么了,2016-6-9 9:32,0,0,0,1,0,0,1
1421,w***8,宝贝和描述相符，店家发货快，服务好。,2016-6-9 9:24,0,0,0,1,0,0,0
1422,f***g,这个价钱实惠。,2016-6-9 9:17,0,0,1,0,0,0,0
1423,l***3,聚划算入手，上次的还没吃完，先好评。,2016-6-9 9:03,0,0,0,0,0,0,0
1424,y***7,昨天收到货沏了一杯感觉茶叶一般，优惠价格买的便宜吗也就值这个价格，作为喝茶的常客应该买贵（好）一些的。,2016-6-9 8:32,0,1,1,0,0,0,1
1425,愤***拉,非常不错。味道嘛，闻着打开还是蛮香的。,2016-6-9 7:53,0,1,0,0,0,0,0
1426,6***p,聚划算59，用了30帮忙红包后29元入手，价格还是蛮便宜的，茶叶也不错！,2016-6-9 7:07,0,0,1,0,0,0,0
1427,y***g,茶还够喝上一年半载的，看到卢正浩搞得聚划算，有紫砂杯子送，就再来二包，为了紫砂杯，夜里十二点在网上购物，但收货后，感到被骗子愚弄了，说你不在名单之列，我当时看聚划算上的购物人数据你们的界限数还早呢，当然，今天还是你们说了算，不过我觉得，欺骗消费者，也就只能一次，你们如此无诚信可言，我不会再来的，一锤子买卖呗,2016-6-9 4:15,0,0,0,1,0,0,1
1428,m***o,茶叶还不错，自己喝还行&hellip;&hellip;,2016-6-9 2:03,0,1,0,0,0,0,0
1429,a***s,不错，味道很正。,2016-6-9 0:09,0,1,0,0,0,0,0
1430,世***6,茶叶收到，还没品尝,2016-6-8 23:58,0,0,0,0,0,0,2
1431,s***0,口粮级的茶，能喝好一阵子了。一直都在卢正浩买呢，会推荐同学的。大赞,2016-6-8 23:55,0,1,0,0,0,0,0
1432,t***z,茶叶包裹很精美，茶叶收到很耐泡， 服务很好，给五星,2016-6-8 23:51,1,1,0,1,0,0,0
1433,黄***好,物流还是相当负责的，晚上九点半还送货！物品也很好！赞一个！,2016-6-8 23:43,0,0,0,0,1,0,0
1434,l***3,有点碎，但是这价格也值了，况且还抢了一个杯子，哈哈。,2016-6-8 23:37,0,1,1,1,0,0,0
1435,幸***4,物流速度很快，卖家服务态度很好,2016-6-8 23:10,0,0,0,1,1,0,0
1436,n***9,速度快，喝着感觉还不错,2016-6-8 23:04,0,1,0,0,1,0,0
1437,f***i,试唱了一杯，味道不错，茶叶有点碎，这个价格挺值的，还送了茶杯。,2016-6-8 22:41,0,1,1,1,0,0,0
1438,t***q,不错味道正宗,2016-6-8 22:34,0,1,0,0,0,0,0
1439,t***2,茶叶很不错，又买了一包,2016-6-8 22:32,0,0,0,0,0,0,0
1440,w***2,作为口粮茶性价比还是比较高的,2016-6-9 14:24,0,0,1,0,0,0,0
1441,荒***k,茶叶很好，没想到这么快，而且送了茶杯，太意外了，一直喝卢正浩的茶叶，一年会光顾几次，卢正浩茶叶口感蛮适合自己，谢谢?,2016-6-9 14:01,0,1,0,1,0,0,0
1442,小***m,宝贝收到了，非常好！同时还收到前100名赠送的紫砂杯！,2016-6-9 13:41,0,0,0,1,0,0,0
1443,t***3,茶收后，立即确认收货，老客户，满意，淡谈茶香，很喜欢,2016-6-9 13:13,0,1,0,0,0,0,0
1444,t***2,刚收货，包装好，物流快，服务好，待品试后再追评,2016-6-9 13:10,0,0,0,1,1,0,0
1445,淘***8,香味浓郁，口感舒服！,2016-6-9 13:04,0,1,0,0,0,0,0
1446,孤***1,香高味长，包装精美，价廉物美，超值。,2016-6-9 13:00,1,1,1,0,0,0,0
1447,迟***x,还行吧 一般,2016-6-9 12:14,0,0,0,0,0,0,0
1448,泠***汀,小茶人贡羽服务很好。至于茶叶，对得起这个价格了。,2016-6-9 11:46,0,1,1,1,0,0,0
1449,w***6,很好最好再送几泡试泡茶。希望多搞些活动,2016-6-9 11:21,0,0,0,1,0,0,0
1450,x***1,包装的很细心，味道不错，送人自用都不错,2016-6-9 11:15,1,1,0,0,0,0,0
1451,上***想,很少喝绿茶，听说防癌去火所以品尝，感觉不错有一股豆香味。商家服务好。,2016-6-9 11:11,0,1,0,1,0,0,0
1452,g***0,包装很用心仔细，茶是新茶很香，这次还抢到了杯子，很开心很满意！,2016-6-9 11:11,1,1,0,1,0,0,0
1453,l***4,茶的味道还不错，在这个价位已经算很好了，满意！,2016-6-9 11:07,0,1,1,0,0,0,0
1454,你***4,还没喝，等喝了才评价,2016-6-9 10:44,0,0,0,0,0,0,0
1455,刘***9,很好！ 热情！,2016-6-9 10:33,0,0,0,1,0,0,0
1456,j***0,每次都在这家买茶叶，清明节已买过了，此次买是冲着赠送茶杯而买的，可惜还是没有买在前100名，买了2包也没有杯子送，可惜了。??,2016-6-9 10:23,0,0,0,1,0,0,0
1457,z***6,香气还行.味道也浓.汤色还行.还好.但一分钱一分货.可以理解,2016-6-9 9:41,0,1,1,0,0,0,0
1458,韩***3,茶叶不错，送了两个袋子一个茶架，袋子可有可无，茶夹子多送一个更好，毕竟是两包茶,2016-6-9 9:38,0,1,0,1,0,0,0
1459,o***o,,2016-6-9 9:34,0,0,0,0,0,0,
1460,只***人,上次买过了，很好，,2016-6-9 18:27,0,0,0,0,0,0,0
1461,x***6,泡了一杯，不错的。,2016-6-9 18:21,0,0,0,0,0,0,0
1462,哈***f,还行，挺整齐,2016-6-9 18:19,0,1,0,0,0,0,0
1463,g***海,很好，香气十足！喝完再买！,2016-6-9 18:00,0,1,0,0,0,0,0
1464,我***4,太一般了,2016-6-9 17:49,0,0,0,0,0,0,1
1465,鹏***m,大品牌，绝对是新茶，清香扑鼻，好喝。,2016-6-9 17:39,0,1,0,0,0,0,0
1466,看***7,买了很多次了，一如既往的好！！,2016-6-9 17:27,0,1,0,0,0,0,0
1467,t***2,送人的，没打开，不过豆香味挺浓的，好评！,2016-6-9 17:26,0,1,0,0,0,0,0
1468,h***7,老顾客了，用了红包，很实惠。年中大促再来！,2016-6-9 16:47,0,0,1,0,0,0,0
1469,6***c,还没喝，经常买这家。,2016-6-9 16:47,0,0,0,0,0,0,0
1470,d***1,茶好！有个罐子就更好了,2016-6-9 16:40,0,0,0,1,0,0,0
1471,慧***2,速度蛮快，包装认真精致，非常满意的一次购物给满分5分，还没有喝，喝了以后再来追加,2016-6-9 16:30,0,0,0,1,1,0,0
1472,咏***1,茶已收到，赠品也很喜欢，在聚划算买到的，确实便宜，茶还没喝，喝好追评,2016-6-9 16:16,0,0,1,1,0,0,0
1473,祖***陆,一如既往，货真价实。甚好！,2016-6-9 16:12,0,0,1,0,0,0,0
1474,w***n,好喝！常年都喝龙井茶。经济实惠。,2016-6-9 15:52,0,1,1,0,0,0,0
1475,t***6,看上去不错，满分，以后追评,2016-6-9 15:28,0,0,0,0,0,0,0
1476,j***5,都可以,2016-6-9 15:06,0,0,0,0,0,0,0
1477,k***2,正宗西湖龙井，价格还很便宜，很值得买。,2016-6-9 15:01,0,0,1,0,0,0,0
1478,l***8,送了个杯子，包装精美，茶叶个大，口味也不错，喝后口有余香,2016-6-9 14:27,1,1,0,0,0,0,0
1479,中***节,茶叶值这个价，满香的，好评。,2016-6-9 14:26,0,1,1,0,0,0,0
1480,达***z,说实话物流真不错，茶叶也挺好，但还需要改进,2016-6-9 22:07,0,1,0,0,1,0,0
1481,m***7,太淡，换其它品种再试试,2016-6-9 21:32,0,1,0,0,0,0,1
1482,丶***姻,味道挺不错的，喝完还会再买的。,2016-6-9 21:27,0,1,0,0,0,0,0
1483,h***0,不错，清香,2016-6-9 21:20,0,1,0,0,0,0,0
1484,t***6,挺合算，望商家常做特价，满意！,2016-6-9 20:54,0,0,1,0,0,0,0
1485,王***0,闻起来很香，喝起来口感很好?清香。我喜欢?果然是2015年的茶叶?这价钱?值了！,2016-6-9 20:47,0,1,0,0,0,0,0
1486,a***9,一般，清淡，没有艺福堂78元250克罐装的好。,2016-6-9 20:46,0,1,0,0,0,0,1
1487,l***e,卖家发货非常快，茶叶也非常好，客服服务很周到，非常感谢客服。,2016-6-9 20:42,0,1,0,1,0,0,0
1488,虞***亲,很好，价廉物美，值得购买。,2016-6-9 20:16,0,1,1,0,0,0,0
1489,玛***8,发货快，茶叶自己喝喝还可以，这个价格也就是这个质量了。,2016-6-9 20:10,0,1,1,1,0,0,0
1490,z***q,服务包装都很到位，还没泡，看着很不错,2016-6-9 20:06,1,0,0,1,0,0,0
1491,2***剑,性价比超高，还抢到了杯子,2016-6-9 20:01,0,0,1,1,0,0,0
1492,夏***5,还不错  已经是老顾客了，贡羽的服务态度也不错  很满意，下次还来找贡羽买,2016-6-9 20:01,0,0,0,1,0,0,0
1493,t***1,,2016-6-9 19:44,0,0,0,0,0,0,
1494,夏***风,口感不错,2016-6-9 19:06,0,1,0,0,0,0,0
1495,冬***8,茶叶价钱挺划算，但喝一杯行，第二杯就没茶叶味，好货不便宜便宜没好货，一分钱一分货，再也不买便宜的了。,2016-6-9 19:04,0,1,1,0,0,0,1
1496,n***8,买过很多次了,2016-6-9 18:49,0,0,0,0,0,0,0
1497,美***鸟,相当不错,2016-6-9 18:46,0,0,0,0,0,0,0
1498,x***3,茶叶不错，下次还来，评5分。,2016-6-9 18:29,0,0,0,0,0,0,0
1499,周***0,东西很不错的,2016-6-9 18:27,0,0,0,0,0,0,0
1500,x***8,非常好，我已经多次购买了。,2016-6-10 9:12,0,0,0,0,0,0,0
1501,_***_,感觉不是很耐泡，不过这个价钱确实挺值的。物流挺快。还学做了茶酒,2016-6-10 8:55,0,1,0,0,1,0,1
1502,z***0,同样是三级的，没有去年的好,2016-6-10 8:23,0,0,0,0,0,0,1
1503,魏***7,感觉还可以。,2016-6-10 8:23,0,0,0,0,0,0,0
1504,嘉***民,品质还是一如既往的好!,2016-6-10 8:11,0,1,0,0,0,0,0
1505,可***y,好评，很清香！还送了小礼物！,2016-6-10 6:22,0,1,0,0,0,0,0
1506,王***为,味道比较清淡，喜欢清淡的可以买来喝喝 好评,2016-6-10 6:08,0,1,0,0,0,0,0
1507,张***1,是正宗龙井，还好,2016-6-10 5:07,0,0,0,0,0,0,0
1508,h***b,非常不错的茶叶,2016-6-10 4:30,0,0,0,0,0,0,0
1509,苹***a,第二次购买了，不错的。,2016-6-10 0:56,0,0,0,0,0,0,0
1510,j***k,收到就喝了 味道一般 颜色比较沉 性价比一般,2016-6-10 0:01,0,1,1,0,0,0,1
1511,秋***湖,宝贝是多次购买，超级满意，特别表扬＂白玲&rdquo;谢谢,2016-6-10 0:01,0,0,0,1,0,0,0
1512,z***p,第二次买了，绝对物超所值,2016-6-9 23:37,0,0,1,0,0,0,0
1513,o***1,包装不错 还没喝,2016-6-9 23:04,1,0,0,0,0,0,0
1514,s***8,收到了，喝后在评价,2016-6-9 23:04,0,0,0,0,0,0,2
1515,j***7,非常值得入手！,2016-6-9 22:53,0,0,0,0,0,0,0
1516,长***0,茶叶是明前的，味道超出了这个价位，好评,2016-6-9 22:29,0,1,1,0,0,0,0
1517,h***i,非常好的茶叶，经济实惠！,2016-6-9 22:21,0,0,1,0,0,0,0
1518,s***4,一般般，不过就这价格不是,2016-6-9 22:16,0,0,1,0,0,0,1
1519,刘***8,茶叶挺好的，老妈喜欢，以后有需要还来,2016-6-9 22:13,0,0,0,0,0,0,0
1520,v***n,茶如人生，细细品味，做安静的人，做安静的事，西湖龙井很不错，清鲜爽翠，人口嫩甜，适合这个美好的夏天！胎菊也很不错，颗粒均匀，没有杂质，味道浓郁，玫瑰还没有拆开，下回展示I(^&omega;^)J,2016-6-10 12:55,0,1,0,0,0,0,0
1521,闫***2,不错，期待下一次 很好,2016-6-10 12:48,0,0,0,0,0,0,0
1522,y***3,"实惠,好评!",2016-6-10 12:37,0,0,1,0,0,0,0
1523,李***5,比实体店便宜,2016-6-10 12:24,0,0,1,0,0,0,0
1524,s***7,茶叶还不错，送了一个陶瓷杯子很文艺。,2016-6-10 12:09,0,0,0,1,0,0,0
1525,蒋***9,包装新颖，茶质量不错，搞活动时买的，性价比高。好评。,2016-6-10 11:56,1,1,1,0,0,0,0
1526,t***9,没有上次的好，价格是偏宜点，但发的是三级，有点上当！,2016-6-10 11:30,0,1,1,0,0,0,1
1527,哗***琳,这茶收到已品尝过，口感不错，继续关注。,2016-6-10 11:17,0,1,0,0,0,0,0
1528,九***z,聚划算买的，包装挺好，茶色翠绿，满意喜欢，好评！清清爽爽，性价比高。,2016-6-10 10:57,1,1,1,0,0,0,0
1529,b***1,茶很不错，很干净，香味浓郁，这个价位买到这样的茶已经是物超所值啦！以后还会继续关注！,2016-6-10 10:53,0,1,1,0,0,0,0
1530,k***萍,看相不行 味道还行 聚划算买的办公室喝喝对得起这价位,2016-6-10 10:47,0,1,1,0,0,0,0
1531,y***g,"买了好多?,感觉越来越贵了。",2016-6-10 10:37,0,0,1,0,0,0,1
1532,h***8,"不错，包装很精细,口感好",2016-6-10 10:31,1,1,0,0,0,0,0
1533,不***1,第二次在这家店铺买了，茶叶质量还可以！,2016-6-10 10:31,0,1,0,0,0,0,0
1534,吴***0,半价购买很优惠，喝过的茶很喜欢,2016-6-10 10:03,0,1,1,0,0,0,0
1535,y***1,挺好的，旗灵 服务相当耐心。下次还会来~,2016-6-10 10:02,0,0,0,1,0,0,0
1536,w***4,第一次买这种茶，感觉还行，以前喝铁观音的,2016-6-10 10:02,0,0,0,0,0,0,0
1537,美***l,第二次买了，送给老爸喝的。,2016-6-10 9:57,0,0,0,0,0,0,0
1538,万***明,茶叶一般，只是这个价也就这个档次了,2016-6-10 9:50,0,1,1,0,0,0,1
1539,和***1,是真茶。下午喝了两杯，凌晨4点都没睡着。 是真有效，失眠朋友的福音。,2016-6-10 9:31,0,1,0,0,0,0,0
1540,h***g,感觉不错！,2016-6-10 20:17,0,0,0,0,0,0,0
1541,a***4,雨前三级，豆香味不浓，还好价格不贵，和同级别别家的相比还是差点，习惯好评吧！,2016-6-10 20:13,0,1,1,0,0,0,1
1542,k***j,不错嘛，对得起这个价格，口味可以。,2016-6-10 19:49,0,1,1,0,0,0,0
1543,无***1,太好啦！包装好，屏强。,2016-6-10 19:37,1,0,0,0,0,0,0
1544,y***6,自己喝的还没尝，应该还不错,2016-6-10 19:30,0,0,0,0,0,0,0
1545,q***8,物有所值。,2016-6-10 18:43,0,0,0,0,0,0,0
1546,杨***1,茶叶不错。促销买的。实惠。卖家发货很快。。。。。。。。。。。。,2016-6-10 18:13,0,0,1,1,0,0,0
1547,y***9,第一次网上买茶叶，茶叶拿到手都是碎的。闻见还行，泡了一杯发现茶叶新旧都有。本来还想茶叶好以后就在你店买了。现在看来还是在当地买比较合适。,2016-6-10 17:51,0,1,0,0,0,0,1
1548,n***g,66大促价格很合适，还没喝，希望不错,2016-6-10 17:44,0,0,1,0,0,0,0
1549,时***语,茶叶一般，我是为了杯子才买的，结果杯子没得到。重点说说快递，信息更新太慢，6月8号的晚上查询信息，还在航空部，家里就没留人，结果第二天早上得我打电话告诉我快递到家门口了，本想让快递员拿回去，但快递员执意放在门口，只好放在门口的箱子里了，幸亏这是几十元的东西，要是贵重物品我都不知道怎么办了。 卖家服务没说的，好！,2016-6-10 17:33,0,1,0,1,1,0,1
1550,l***水,不错的口粮茶，打开包装就闻到龙井特有的清香，口感不错，清爽有回甘，包装环保，喜欢！ 卖家发货很快，服务周到，好评！,2016-6-10 17:30,1,1,0,1,0,0,0
1551,l***7,前一百名送了个茶杯，吼吼，全五分。,2016-6-10 17:06,0,0,0,1,0,0,0
1552,天***凯,包装不错，挺有传统特色，汤色，口感很对得起这个价格。满意。图片为三泡后的汤色。,2016-6-10 17:00,0,0,0,0,0,0,0
1553,谁***9,茶叶一般，这个价位的茶叶不会让你超出想象的！,2016-6-10 16:39,0,1,1,0,0,0,1
1554,c***0,宝贝收到了，给老爸买的，还没喝，味道怎么样，等喝了以后再评价吧！,2016-6-10 16:17,0,0,0,0,0,0,2
1555,姬***亮,包装挺好，口味也不错，性价比还不错！,2016-6-10 15:58,1,1,1,0,0,0,0
1556,h***祥,宝贝很快收到，速度很快啊！包装很结实，卖家态度很好 ，有问必答。味道嘛，还没品。好喝还会来的。老客户了。,2016-6-10 15:38,1,0,0,1,1,0,0
1557,x***n,味道可以不错,2016-6-10 14:48,0,1,0,0,0,0,0
1558,z***8,收到货，泡了一杯，茶叶品相相对差一点，茶梗相对多些，但是味道还不错,2016-6-10 13:31,0,1,0,0,0,0,1
1559,t***7,价廉物美。很好,2016-6-10 13:25,0,1,1,0,0,0,0
1560,y***0,不错，实惠。,2016-6-11 8:11,0,0,1,0,0,0,0
1561,t***2,三等茶叶，一等味道。好茶,2016-6-11 8:09,0,1,0,0,0,1,0
1562,t***4,收到了，送给爸妈了，包装挺好的，还可以,2016-6-11 7:25,1,0,0,0,0,0,0
1563,朗***8,很好，信任卢正浩。,2016-6-11 7:18,0,0,0,0,0,1,0
1564,l***6,豆香味浓，不错的口粮茶,2016-6-11 7:12,0,0,0,0,0,0,0
1565,n***1,"茶叶味道很好,价格有些小贵,发货包装没问题,基本满意",2016-6-11 5:34,1,1,1,0,0,0,1
1566,m***5,买过多次，这次的还没喝，好评先,2016-6-11 0:57,0,0,0,0,0,0,2
1567,麻***2,质量、包装都不错。,2016-6-11 0:09,1,1,0,0,0,0,0
1568,f***6,应该不是新茶,2016-6-10 23:50,0,1,0,0,0,0,1
1569,天***y,买给送人的，还有礼盒，包装不错，好评,2016-6-10 23:30,1,0,0,0,0,1,0
1570,t***9,好评，支持卢正浩。,2016-6-10 21:54,0,0,0,0,0,1,0
1571,a***8,搞活动的产品只能说差差差,2016-6-10 21:51,0,0,0,0,0,1,1
1572,靠***y,挺好的，不错,2016-6-10 21:48,0,0,0,0,0,0,0
1573,华***器,不错，喜欢淡淡的清香味，虽然不经泡，对我够了,2016-6-10 21:34,0,0,0,0,0,1,1
1574,t***1,"非常满意, 一流,",2016-6-10 21:16,0,0,0,0,0,0,0
1575,b***g,没有三级茶叶的品质，总体感觉一般，也许我用的是自来水吧，茶叶中单叶较多，当然想便宜买好的茶叶有点不好意思，但是聚划算嘛，是想尝试一下，希望能够给一般人喝较好品质的机会，谢谢客服的喝茶之道！,2016-6-10 21:08,0,1,1,1,0,1,1
1576,t***o,每年这时候必买的口粮茶，虽然还没开喝，但相信卢正浩&hellip;&hellip;多年的信任,2016-6-10 20:56,0,0,0,0,0,1,0
1577,雄***7,不错，挺好,2016-6-10 20:45,0,0,0,0,0,0,0
1578,孺***3,包装精致，闻起来有清香味！,2016-6-10 20:40,1,0,0,0,0,0,0
1579,飘***7,货己收到，给老人买的，还没有喝应该不错吧,2016-6-10 20:23,0,0,0,0,0,0,2
1580,p***4,还没喝，习惯性好评，味道好还会来。发货，物流速度快。,2016-6-11 14:18,0,0,0,1,1,0,0
1581,h***i,老顾客，经常买,2016-6-11 13:48,0,0,0,0,0,0,0
1582,t***4,还可以吧，感觉不太像新茶,2016-6-11 13:30,0,1,0,0,0,0,1
1583,小***6,第二次买了，上次的还没喝完，看这次聚划算先买来备着,2016-6-11 13:12,0,0,0,0,0,1,0
1584,范***军,还没喝，应该不错！,2016-6-11 12:41,0,0,0,0,0,0,2
1585,z***6,茶叶一般，闻着很香，冲泡一次后就没味了，第二次就是在喝白开水，其实茶叶量放得很足,2016-6-11 11:53,0,1,0,0,0,1,1
1586,x***6,给老爸买的，老爸说味道有点淡，,2016-6-11 10:54,0,1,0,0,0,0,1
1587,t***6,茶叶很一般，只是闻着有点清香，口感太一般了！,2016-6-11 10:52,0,1,0,0,0,0,1
1588,泼***人,茶叶味道还不错，送货快,2016-6-11 10:47,0,1,0,0,1,0,0
1589,s***9,茶很香，还不错,2016-6-11 10:27,0,1,0,0,0,0,0
1590,t***3,包装的很仔细，谢谢店家送的封口夹。口味一般般吧，还算可以，毕竟这个价格在这摆着呢。,2016-6-11 10:16,1,1,1,0,0,1,0
1591,强***1,味道不错，物有所值。小茶人小梅态度好，有耐心,2016-6-11 10:10,0,1,1,1,0,0,0
1592,君***1,物流挺快，物流也挺暴力。装茶叶的纸箱凹陷～～茶叶还是熟悉的味道,2016-6-11 10:08,0,1,0,0,1,0,1
1593,c***r,不错，很香，很清爽,2016-6-11 9:36,0,1,0,0,0,0,0
1594,乐***9,这茶不如上次拍的口粮茶好喝。闻着香泡水不香，回甘不太好。拍了好几款都好喝，就这个不理想,2016-6-11 9:32,0,1,0,0,0,0,1
1595,妞***媚,给爸爸买的，他说特别好,2016-6-11 9:31,0,0,0,0,0,0,0
1596,已***你,可以说谁买谁上当他们家好评都是刷的茶叶差的不得了我已经投诉了,2016-6-11 9:29,0,1,0,0,0,0,1
1597,喝***乐,口粮茶，三年了，一如既往的好 好,2016-6-11 9:20,0,0,0,0,0,0,0
1598,z***8,以后的茶叶就在这儿买了,2016-6-11 9:07,0,0,0,0,0,0,0
1599,老***明,没喝，看着不错。,2016-6-11 9:01,0,0,0,0,0,0,2
1600,z***7,包装一般不是太上档次，茶未喝,2016-6-11 23:14,1,0,0,0,0,0,1
1601,b***w,老客户了，经常买。,2016-6-11 22:39,0,0,0,0,0,0,0
1602,海***5,还可以吧 我爸说的,2016-6-11 21:46,0,0,0,0,0,0,0
1603,h***7,还真有杯子送，虽然一般，但还是让人欣喜的,2016-6-11 19:13,0,0,0,0,0,1,0
